{
  "stable_id": "detection.sigma.shadow_copies_deletion@v1",
  "content_version": "0.1.0",
  "maturity": "experimental",
  "title": "Shadow Copies Deletion via OS utilities (ransomware backup-disabling precursor)",
  "summary": "Pointer to the upstream SigmaHQ rule that flags use of OS utilities (vssadmin, wmic, PowerShell) to delete Volume Shadow Copies. This is the highest-precision ransomware-prep signal: almost no benign tooling deletes shadow copies at the rate ransomware families do, and the action consistently precedes encryption by seconds-to-minutes. Drives the triage step of the ransomware_containment playbook. SecOps-NG does not re-author Sigma rules; this artifact carries the upstream rule_id as a stable pointer.",
  "sigma": {
    "rule_id": "c947b146-0abc-4c87-9c64-b17e9d7274a2",
    "repo": "https://github.com/SigmaHQ/sigma",
    "path": "rules/windows/process_creation/proc_creation_win_susp_shadow_copies_deletion.yml",
    "tags": [
      "attack.impact",
      "attack.t1490"
    ]
  },
  "logsource": {
    "product": "windows",
    "category": "process_creation"
  },
  "severity": "high",
  "control_refs": [
    "control.endpoint_isolation@v1"
  ],
  "telemetry_refs": [
    "telemetry.ocsf.process_activity@v1"
  ],
  "playbook_refs": [
    {
      "playbook_id": "playbook.ransomware_containment@v1",
      "step_id": "action--30000000-0000-4000-8000-000000000002"
    }
  ],
  "sources": [
    "SigmaHQ — Shadow Copies Deletion Using Operating Systems Utilities (rule_id c947b146-0abc-4c87-9c64-b17e9d7274a2)",
    "MITRE ATT&CK — T1490 Inhibit System Recovery"
  ],
  "maintainer": "detections-wg@secops-ng.org"
}
